{
  "player_id": "player-15426",
  "name": "矢島 遼大",
  "reg_no": 15426,
  "consent": "本人の同意により公開(2026-07-30)",
  "history": [
    {
      "kai": 33,
      "season": "R06",
      "season_label": "令和6年度",
      "team": "紫龍会",
      "division": "5部白",
      "rating": 1421,
      "games": 14,
      "source_url": "https://toushouren.world.coocan.jp/shadan/33/33_ranking_04_all.pdf"
    },
    {
      "kai": 34,
      "season": "R07",
      "season_label": "令和7年度",
      "team": "立教大学紫龍会",
      "division": "3部白",
      "rating": 1414,
      "games": 20,
      "source_url": "https://toushouren.world.coocan.jp/shadan/34/34_ranking_04_all.pdf"
    },
    {
      "kai": 35,
      "season": "R08",
      "season_label": "令和8年度(第3節時点)",
      "team": "紫龍会",
      "division": "6部白",
      "rating": 1459,
      "games": 28,
      "source_url": "https://toushouren.world.coocan.jp/shadan/35/35_ranking_03_all.pdf"
    }
  ]
}